{
  "version": "1.0.0-draft",
  "subject": {
    "name": "Jan Kowalski",
    "id": "jan-kowalski-fictional-cto"
  },
  "created_at": "2026-03-18T00:09:57.134Z",
  "chunks": [
    {
      "chunk_id": "TDM-HEUR-001",
      "author": "Jan Kowalski",
      "cluster": "technical-decision-making",
      "type": "heuristic",
      "uniqueness": "CRITICAL",
      "source": "interview",
      "confidence": 0.95,
      "context_tags": [
        "architecture",
        "framework-selection",
        "risk-assessment"
      ],
      "linked_chunks": [],
      "content": "When evaluating any new framework or library for adoption, Jan always checks the 'bus factor' first — how many active maintainers exist and what the commit frequency looks like over the past 6 months. This stems from a 2020 incident where a critical dependency had a single maintainer who disappeared, forcing a 3-week emergency migration mid-sprint. He will reject a technically superior option if the bus factor is below 3."
    },
    {
      "chunk_id": "TDM-HEUR-002",
      "author": "Jan Kowalski",
      "cluster": "technical-decision-making",
      "type": "heuristic",
      "uniqueness": "CRITICAL",
      "source": "meeting",
      "confidence": 0.92,
      "context_tags": [
        "database",
        "scaling",
        "cost-control"
      ],
      "linked_chunks": [],
      "content": "Jan enforces a hard rule that no database query in production may perform a full table scan on any table exceeding 1 million rows. He requires EXPLAIN ANALYZE output in every PR that touches a query. This rule was born from a $47K AWS bill spike in Q3 2021 when an unoptimized report query ran hourly against a 200M-row events table for two weeks before anyone noticed."
    },
    {
      "chunk_id": "TDM-HEUR-003",
      "author": "Jan Kowalski",
      "cluster": "technical-decision-making",
      "type": "heuristic",
      "uniqueness": "CRITICAL",
      "source": "meeting",
      "confidence": 0.91,
      "context_tags": [
        "microservices",
        "deployment",
        "boundaries"
      ],
      "linked_chunks": [],
      "content": "Jan insists that any new microservice must own exactly one bounded context and expose no more than 7 public API endpoints at launch. He calls services that exceed this threshold 'baby monoliths' and forces teams to split them before deployment. This rule emerged from a painful 2019 refactor where a 43-endpoint 'user service' became the single point of failure for the entire platform."
    },
    {
      "chunk_id": "TDM-ANTI-001",
      "author": "Jan Kowalski",
      "cluster": "technical-decision-making",
      "type": "anti-pattern",
      "uniqueness": "HIGH",
      "source": "code",
      "confidence": 0.9,
      "context_tags": [
        "orm",
        "database",
        "abstraction"
      ],
      "linked_chunks": [],
      "content": "Jan refuses to use ORM-generated queries for any reporting or analytics workload. He considers ORMs acceptable only for simple CRUD on entities with fewer than 5 joins. After inheriting a codebase where Hibernate had generated 47-join queries that brought down production, he mandates raw SQL or query builders for anything touching aggregation, and has blocked multiple PRs over this."
    },
    {
      "chunk_id": "TDM-ANTI-002",
      "author": "Jan Kowalski",
      "cluster": "technical-decision-making",
      "type": "anti-pattern",
      "uniqueness": "HIGH",
      "source": "interview",
      "confidence": 0.88,
      "context_tags": [
        "premature-optimization",
        "scaling",
        "yagni"
      ],
      "linked_chunks": [],
      "content": "Jan explicitly bans premature horizontal scaling discussions before a service hits 70% of its projected peak load. He has a phrase he uses in architecture reviews: 'Show me the flame graph, not the whiteboard.' Teams caught designing for 10x scale before achieving 1x product-market fit are redirected to focus on correctness and observability first."
    },
    {
      "chunk_id": "TDM-PREF-001",
      "author": "Jan Kowalski",
      "cluster": "technical-decision-making",
      "type": "preference",
      "uniqueness": "MEDIUM",
      "source": "chat",
      "confidence": 0.85,
      "context_tags": [
        "language",
        "typescript",
        "type-safety"
      ],
      "linked_chunks": [],
      "content": "Jan strongly prefers TypeScript over JavaScript for all new projects and has mandated strict mode with no 'any' types in production code. He considers dynamic typing acceptable only in throwaway scripts and prototypes. His reasoning is pragmatic rather than ideological — he estimates that TypeScript catches roughly 40% of the bugs his teams used to find in code review."
    },
    {
      "chunk_id": "TDM-PREF-002",
      "author": "Jan Kowalski",
      "cluster": "technical-decision-making",
      "type": "preference",
      "uniqueness": "MEDIUM",
      "source": "document",
      "confidence": 0.87,
      "context_tags": [
        "infrastructure",
        "iac",
        "terraform"
      ],
      "linked_chunks": [],
      "content": "Jan requires all infrastructure to be managed through Terraform with no manual console changes permitted. Every infrastructure change must go through the same PR review process as application code. He maintains a 'drift detector' that runs hourly and pages on-call if any resource diverges from its declared state, treating infrastructure drift as a P1 incident."
    },
    {
      "chunk_id": "TDM-FRMW-001",
      "author": "Jan Kowalski",
      "cluster": "technical-decision-making",
      "type": "framework",
      "uniqueness": "CRITICAL",
      "source": "document",
      "confidence": 0.93,
      "context_tags": [
        "architecture",
        "decision-making",
        "trade-offs"
      ],
      "linked_chunks": [],
      "content": "Jan uses a mental model he calls the 'Reversibility Matrix' for all architectural decisions. He classifies every choice on two axes: cost-to-reverse (low/medium/high) and blast-radius (team/service/platform). Decisions that are high-cost-to-reverse AND platform-blast-radius require a written RFC with a 72-hour review period — no exceptions, even under deadline pressure. Everything else can be decided in a 30-minute call. He credits this framework with reducing his company's architectural regret rate from 'constant' to 'quarterly.'"
    },
    {
      "chunk_id": "TDM-FRMW-002",
      "author": "Jan Kowalski",
      "cluster": "technical-decision-making",
      "type": "framework",
      "uniqueness": "CRITICAL",
      "source": "interview",
      "confidence": 0.9,
      "context_tags": [
        "technology-radar",
        "adoption",
        "evaluation"
      ],
      "linked_chunks": [],
      "content": "Jan maintains a quarterly internal 'Technology Radar' modeled after ThoughtWorks' format but with a crucial addition: a 'Graveyard' ring for technologies the team has tried and explicitly rejected, with documented reasons. New hires must read the Graveyard before proposing any technology. He has found this eliminates roughly 60% of 'why don't we use X?' discussions because X is usually already in the Graveyard with a post-mortem."
    },
    {
      "chunk_id": "TDM-BLEF-001",
      "author": "Jan Kowalski",
      "cluster": "technical-decision-making",
      "type": "belief",
      "uniqueness": "HIGH",
      "source": "interview",
      "confidence": 0.89,
      "context_tags": [
        "complexity",
        "simplicity",
        "architecture"
      ],
      "linked_chunks": [],
      "content": "Jan believes that the primary job of a senior engineer is to reduce accidental complexity, not to solve hard problems. He frequently quotes Rich Hickey's distinction between 'simple' and 'easy' and will push back on solutions that are easy to implement but introduce hidden coupling. He has rejected production-ready PRs because they 'made the simple thing complicated for the sake of the clever thing.'"
    },
    {
      "chunk_id": "TDM-STRY-001",
      "author": "Jan Kowalski",
      "cluster": "technical-decision-making",
      "type": "story",
      "uniqueness": "HIGH",
      "source": "interview",
      "confidence": 0.86,
      "context_tags": [
        "migration",
        "failure",
        "learning"
      ],
      "linked_chunks": [],
      "content": "In 2022, Jan led a migration from a monolithic PostgreSQL instance to a sharded architecture. The team spent 4 months on a custom sharding layer before Jan realized they were solving an imaginary problem — the actual bottleneck was a single unindexed join in the reporting module. He killed the sharding project, added the index, and performance improved 200x. He now tells this story in every architecture review as a warning against 'solution-first thinking.'"
    },
    {
      "chunk_id": "TDM-RITL-001",
      "author": "Jan Kowalski",
      "cluster": "technical-decision-making",
      "type": "ritual",
      "uniqueness": "MEDIUM",
      "source": "observation",
      "confidence": 0.84,
      "context_tags": [
        "architecture-review",
        "decision-log",
        "process"
      ],
      "linked_chunks": [],
      "content": "Every Friday at 4 PM, Jan holds a 30-minute 'Architecture Decision Review' where the team reviews any architectural decisions made that week. Each decision is logged in an ADR (Architecture Decision Record) with four fields: context, decision, consequences, and a 'revisit-by' date. Jan personally reads every ADR and will schedule a follow-up if the consequences section is shorter than the decision section."
    },
    {
      "chunk_id": "LDR-ANTI-001",
      "author": "Jan Kowalski",
      "cluster": "team-leadership",
      "type": "anti-pattern",
      "uniqueness": "HIGH",
      "source": "interview",
      "confidence": 0.88,
      "context_tags": [
        "hiring",
        "interviews",
        "team-building"
      ],
      "linked_chunks": [],